{
 "emon-gold": "1.0",
 "id": "ttab-th-as-td-untagged",
 "provenance": {
  "html": "html/ttab-th-as-td-untagged.html",
  "pdf": "pdf/ttab-th-as-td-untagged.pdf",
  "producer": "Google Chrome 154.0.8037.59 ; "
 },
 "annotated": {
  "structure": [
   "section",
   "heading",
   "paragraph",
   "list",
   "item",
   "table",
   "rowgroup",
   "row",
   "cell",
   "caption",
   "figure",
   "seal",
   "quote",
   "code",
   "note"
  ],
  "attributes": {
   "section": [
    "level"
   ],
   "heading": [
    "level",
    "number",
    "numbering"
   ],
   "list": [
    "ordered",
    "scheme",
    "start"
   ],
   "item": [
    "marker",
    "value"
   ],
   "table": [
    "profile",
    "columns",
    "continued"
   ],
   "rowgroup": [
    "role"
   ],
   "row": [
    "repeated"
   ],
   "cell": [
    "rowspan",
    "colspan",
    "header",
    "empty"
   ],
   "caption": [
    "label"
   ],
   "figure": [
    "subkind",
    "label",
    "alt",
    "labels"
   ],
   "seal": [
    "subkind",
    "name",
    "date",
    "color"
   ],
   "note": [
    "role",
    "marker"
   ]
  },
  "text": true,
  "inlines": true,
  "furniture": true,
  "dropped": [
   "page-number",
   "running-title",
   "watermark",
   "duplicate-header-row"
  ],
  "pages": [
   "n",
   "w",
   "h",
   "label"
  ]
 },
 "model": {
  "pages": [
   {
    "h": 792.0,
    "n": 1,
    "rot": 0,
    "w": 612.0
   }
  ],
  "body": {
   "id": 0,
   "kind": "document",
   "children": [
    {
     "id": 1,
     "kind": "section",
     "level": 1,
     "children": [
      {
       "id": 2,
       "kind": "heading",
       "level": 1,
       "text": "Supplies Ledger"
      },
      {
       "id": 3,
       "kind": "paragraph",
       "text": "The table below was extracted from the supplies ledger. Figures are totals for the quarter."
      },
      {
       "id": 4,
       "kind": "table",
       "profile": "ruled",
       "columns": 4,
       "children": [
        {
         "id": 5,
         "kind": "rowgroup",
         "role": "head",
         "children": [
          {
           "id": 6,
           "kind": "row",
           "children": [
            {
             "id": 7,
             "kind": "cell",
             "header": "col",
             "text": "Item"
            },
            {
             "id": 8,
             "kind": "cell",
             "header": "col",
             "text": "Qty"
            },
            {
             "id": 9,
             "kind": "cell",
             "header": "col",
             "text": "Price"
            },
            {
             "id": 10,
             "kind": "cell",
             "header": "col",
             "text": "Stock"
            }
           ]
          }
         ]
        },
        {
         "id": 11,
         "kind": "rowgroup",
         "role": "body",
         "children": [
          {
           "id": 12,
           "kind": "row",
           "children": [
            {
             "id": 13,
             "kind": "cell",
             "text": "Pens"
            },
            {
             "id": 14,
             "kind": "cell",
             "text": "12"
            },
            {
             "id": 15,
             "kind": "cell",
             "text": "3.40"
            },
            {
             "id": 16,
             "kind": "cell",
             "text": "yes"
            }
           ]
          },
          {
           "id": 17,
           "kind": "row",
           "children": [
            {
             "id": 18,
             "kind": "cell",
             "text": "Paper"
            },
            {
             "id": 19,
             "kind": "cell",
             "text": "4"
            },
            {
             "id": 20,
             "kind": "cell",
             "text": "7.25"
            },
            {
             "id": 21,
             "kind": "cell",
             "text": "no"
            }
           ]
          },
          {
           "id": 22,
           "kind": "row",
           "children": [
            {
             "id": 23,
             "kind": "cell",
             "text": "Tape"
            },
            {
             "id": 24,
             "kind": "cell",
             "text": "9"
            },
            {
             "id": 25,
             "kind": "cell",
             "text": "2.10"
            },
            {
             "id": 26,
             "kind": "cell",
             "text": "yes"
            }
           ]
          }
         ]
        }
       ]
      },
      {
       "id": 27,
       "kind": "paragraph",
       "text": "Questions go to the purchasing office."
      }
     ]
    }
   ]
  },
  "dropped": [],
  "emon": "1.0",
  "furniture": [],
  "meta": {
   "title": "Tagged table"
  },
  "settings": {
   "locale": "en"
  },
  "source": {
   "pages": 1,
   "format": "pdf",
   "lang": "en"
  }
 }
}
