{
 "emon-gold": "1.0",
 "id": "table-slanted-header",
 "provenance": {
  "html": "html/table-slanted-header.html",
  "pdf": "pdf/table-slanted-header.pdf",
  "producer": "Google Chrome 154.0.8037.59 ; Skia/PDF m154",
  "variants": {
   "scan": "scan/table-slanted-header.pdf"
  }
 },
 "annotated": {
  "structure": [
   "section",
   "heading",
   "paragraph",
   "list",
   "item",
   "table",
   "rowgroup",
   "row",
   "cell",
   "caption",
   "figure",
   "seal",
   "quote",
   "code",
   "note"
  ],
  "attributes": {
   "section": [
    "level"
   ],
   "heading": [
    "level",
    "number",
    "numbering"
   ],
   "list": [
    "ordered",
    "scheme",
    "start"
   ],
   "item": [
    "marker",
    "value"
   ],
   "table": [
    "profile",
    "columns",
    "continued"
   ],
   "rowgroup": [
    "role"
   ],
   "row": [
    "repeated"
   ],
   "cell": [
    "rowspan",
    "colspan",
    "header",
    "empty"
   ],
   "caption": [
    "label"
   ],
   "figure": [
    "subkind",
    "label",
    "alt",
    "labels"
   ],
   "seal": [
    "subkind",
    "name",
    "date",
    "color"
   ],
   "note": [
    "role",
    "marker"
   ]
  },
  "text": true,
  "inlines": true,
  "furniture": true,
  "dropped": [
   "page-number",
   "running-title",
   "watermark",
   "duplicate-header-row"
  ],
  "pages": [
   "n",
   "w",
   "h",
   "label"
  ]
 },
 "model": {
  "pages": [
   {
    "h": 792.0,
    "n": 1,
    "rot": 0,
    "w": 612.0
   },
   {
    "h": 792.0,
    "n": 2,
    "rot": 0,
    "w": 612.0
   }
  ],
  "body": {
   "id": 0,
   "kind": "document",
   "children": [
    {
     "id": 1,
     "kind": "section",
     "level": 1,
     "children": [
      {
       "id": 2,
       "kind": "heading",
       "level": 1,
       "text": "Account Matrix"
      },
      {
       "id": 3,
       "kind": "paragraph",
       "text": "Help world was sea big write work between want. Enough quarter after from want day food together to your best first budget figure soon. By knew did not morning word who market think think were out family."
      },
      {
       "id": 4,
       "kind": "paragraph",
       "text": "Room may light their soon say took red. Animal out name hand be school found keep go very now hear land today. Face why white world high by people revenue usually."
      },
      {
       "id": 5,
       "kind": "table",
       "profile": "ruled",
       "columns": 4,
       "children": [
        {
         "id": 6,
         "kind": "rowgroup",
         "role": "head",
         "children": [
          {
           "id": 7,
           "kind": "row",
           "children": [
            {
             "id": 8,
             "kind": "cell",
             "header": "col",
             "text": "Account"
            },
            {
             "id": 9,
             "kind": "cell",
             "header": "col",
             "text": "Owner"
            },
            {
             "id": 10,
             "kind": "cell",
             "header": "col",
             "text": "Region"
            },
            {
             "id": 11,
             "kind": "cell",
             "header": "col",
             "text": "Balance"
            }
           ]
          }
         ]
        },
        {
         "id": 12,
         "kind": "rowgroup",
         "role": "body",
         "children": [
          {
           "id": 13,
           "kind": "row",
           "children": [
            {
             "id": 14,
             "kind": "cell",
             "text": "Operating"
            },
            {
             "id": 15,
             "kind": "cell",
             "text": "Ana"
            },
            {
             "id": 16,
             "kind": "cell",
             "text": "North"
            },
            {
             "id": 17,
             "kind": "cell",
             "text": "12,400"
            }
           ]
          },
          {
           "id": 18,
           "kind": "row",
           "children": [
            {
             "id": 19,
             "kind": "cell",
             "text": "Payroll"
            },
            {
             "id": 20,
             "kind": "cell",
             "text": "Ben"
            },
            {
             "id": 21,
             "kind": "cell",
             "text": "South"
            },
            {
             "id": 22,
             "kind": "cell",
             "text": "8,150"
            }
           ]
          },
          {
           "id": 23,
           "kind": "row",
           "children": [
            {
             "id": 24,
             "kind": "cell",
             "text": "Reserve"
            },
            {
             "id": 25,
             "kind": "cell",
             "text": "Chen"
            },
            {
             "id": 26,
             "kind": "cell",
             "text": "East"
            },
            {
             "id": 27,
             "kind": "cell",
             "text": "31,000"
            }
           ]
          },
          {
           "id": 28,
           "kind": "row",
           "children": [
            {
             "id": 29,
             "kind": "cell",
             "text": "Travel"
            },
            {
             "id": 30,
             "kind": "cell",
             "text": "Dee"
            },
            {
             "id": 31,
             "kind": "cell",
             "text": "West"
            },
            {
             "id": 32,
             "kind": "cell",
             "text": "2,975"
            }
           ]
          },
          {
           "id": 33,
           "kind": "row",
           "children": [
            {
             "id": 34,
             "kind": "cell",
             "text": "Training"
            },
            {
             "id": 35,
             "kind": "cell",
             "text": "Eli"
            },
            {
             "id": 36,
             "kind": "cell",
             "text": "North"
            },
            {
             "id": 37,
             "kind": "cell",
             "text": "1,820"
            }
           ]
          },
          {
           "id": 38,
           "kind": "row",
           "children": [
            {
             "id": 39,
             "kind": "cell",
             "text": "Equipment"
            },
            {
             "id": 40,
             "kind": "cell",
             "text": "Fay"
            },
            {
             "id": 41,
             "kind": "cell",
             "text": "South"
            },
            {
             "id": 42,
             "kind": "cell",
             "text": "6,410"
            }
           ]
          }
         ]
        }
       ]
      },
      {
       "id": 43,
       "kind": "paragraph",
       "text": "Said off upon example region have read country without did. Took end for answer does house use almost report put mother."
      }
     ]
    }
   ]
  },
  "dropped": [],
  "emon": "1.0",
  "furniture": [],
  "meta": {
   "title": "Account Matrix"
  },
  "settings": {
   "locale": "en"
  },
  "source": {
   "pages": 2,
   "format": "pdf",
   "lang": "en"
  }
 }
}
